{"$schema":"https://json-schema.org/draft/2020-12/schema","$id":"https://raw.githubusercontent.com/mikelninh/openaction/main/spec/1.0/approval-path.schema.json","title":"OpenAction Approval Path 1.0 RC1","type":"object","additionalProperties":false,"required":["version","id","product","intended_use","environment","gates","ready_when"],"properties":{"version":{"const":"openaction-approval/1.0-rc1"},"id":{"type":"string","pattern":"^oap_[A-Za-z0-9._-]+$"},"product":{"type":"string","minLength":1},"intended_use":{"type":"string","minLength":1},"environment":{"enum":["sandbox","pilot","production"]},"profile":{"type":"string","maxLength":200},"gates":{"type":"array","minItems":1,"items":{"$ref":"#/$defs/gate"}},"ready_when":{"type":"array","minItems":1,"items":{"type":"string"}},"critical_path":{"type":"array","items":{"type":"string","pattern":"^gate_[A-Za-z0-9._-]+$"}},"notes":{"type":"array","items":{"type":"string"}}},"$defs":{"gate":{"type":"object","additionalProperties":false,"required":["id","category","question","status","blocking","owner_role","evidence_required","automation"],"properties":{"id":{"type":"string","pattern":"^gate_[A-Za-z0-9._-]+$"},"category":{"enum":["purpose","ai_act","privacy","data","security","licensing","procurement","workforce","domain_regulation","clinical_safety","quality","operations","governance","identity","interoperability"]},"question":{"type":"string","minLength":1},"status":{"enum":["unknown","not_applicable","todo","ready_for_review","in_review","approved","rejected","expired","revoked"]},"blocking":{"type":"boolean"},"owner_role":{"type":"string","minLength":1},"reviewer_role":{"type":"string"},"basis":{"type":"array","items":{"type":"object","required":["label"],"properties":{"label":{"type":"string"},"uri":{"type":"string","format":"uri"}}}},"evidence_required":{"type":"array","items":{"type":"string"}},"artifacts":{"type":"array","items":{"type":"string"}},"depends_on":{"type":"array","items":{"type":"string","pattern":"^gate_[A-Za-z0-9._-]+$"}},"can_run_in_parallel":{"type":"boolean"},"sla":{"type":"object","properties":{"target_hours":{"type":"number","minimum":0},"started_at":{"type":"string","format":"date-time"},"due_at":{"type":"string","format":"date-time"}}},"suggested_next_step":{"type":"string"},"automation":{"enum":["manual","assist","auto_prepare_never_approve"]},"receipt_id":{"type":"string","pattern":"^oar_[A-Za-z0-9._-]+$"},"conditions":{"type":"array","items":{"type":"string"}},"expires_at":{"type":"string","format":"date-time"},"reopen_on":{"type":"array","items":{"type":"string","enum":["purpose","data","model","vendor","hosting","workflow","permission","law","identity","security_control"]}}}}}}