{"version":"openaction-approval/1.0-rc1","id":"oap_careos_synthetic_001","product":"CareOS hospital workflow assistant","intended_use":"Prepare evidence-linked summaries and follow-up tasks for clinical staff; no autonomous diagnosis, prescribing or treatment decision.","environment":"pilot","profile":"oaprof_safe_sandbox_v1","gates":[{"id":"gate_purpose","category":"purpose","question":"Is intended use narrow and versioned?","status":"approved","blocking":true,"owner_role":"Clinical Product Owner","evidence_required":["intended-use statement","explicit non-goals","pilot journey"],"can_run_in_parallel":true,"automation":"assist","reopen_on":["purpose","workflow"]},{"id":"gate_privacy","category":"privacy","question":"Are legal basis, minimisation, processor terms, retention and DPIA screening documented?","status":"in_review","blocking":true,"owner_role":"Data Protection","evidence_required":["data-flow map","data inventory","processor list","retention rules","DPIA screening"],"can_run_in_parallel":true,"sla":{"target_hours":72},"automation":"auto_prepare_never_approve","reopen_on":["purpose","data","vendor","hosting"]},{"id":"gate_security","category":"security","question":"Are identity, authorisation, encryption, logging, incident handling and rollback understood?","status":"in_review","blocking":true,"owner_role":"Hospital Information Security","evidence_required":["architecture","authN/authZ","logging plan","threat model","rollback"],"can_run_in_parallel":true,"sla":{"target_hours":72},"automation":"auto_prepare_never_approve","reopen_on":["vendor","hosting","identity","permission","security_control"]},{"id":"gate_clinical_safety","category":"clinical_safety","question":"Do evaluations cover consequential workflow failures and escalation?","status":"in_review","blocking":true,"owner_role":"Clinical Safety Lead","evidence_required":["gold set","critical-error taxonomy","human review rule","escalation policy","limitations"],"can_run_in_parallel":true,"sla":{"target_hours":120},"automation":"assist","reopen_on":["purpose","model","workflow"]},{"id":"gate_interop","category":"interoperability","question":"What exact FHIR/ISiK/TI role does this deployment have?","status":"todo","blocking":true,"owner_role":"Interoperability / TI Lead","evidence_required":["integration map","system role","FHIR resources","TI services touched"],"can_run_in_parallel":true,"automation":"assist","reopen_on":["workflow","hosting","permission"]},{"id":"gate_workforce","category":"workforce","question":"Have affected staff and employee representatives been involved early?","status":"todo","blocking":false,"owner_role":"Change / Employee Representation","evidence_required":["workflow before/after","human override","training plan","feedback channel"],"can_run_in_parallel":true,"automation":"assist","reopen_on":["workflow","purpose"]},{"id":"gate_procurement","category":"procurement","question":"Are vendor, licence, processor, commercial and exit terms reviewable?","status":"todo","blocking":true,"owner_role":"Procurement / Legal","evidence_required":["licence inventory","vendor list","DPA status","commercial terms","exit plan"],"can_run_in_parallel":true,"automation":"auto_prepare_never_approve","reopen_on":["vendor","hosting"]},{"id":"gate_pilot_governance","category":"governance","question":"Are pilot bounds, accountable humans, stop conditions, metrics and rollback approved?","status":"todo","blocking":true,"owner_role":"Pilot Sponsor","evidence_required":["pilot protocol","approval matrix","success metrics","stop conditions","rollback test"],"depends_on":["gate_privacy","gate_security","gate_clinical_safety","gate_interop","gate_procurement"],"can_run_in_parallel":false,"automation":"assist","reopen_on":["purpose","data","model","vendor","hosting","workflow","permission"]}],"ready_when":["all blocking gates approved or explicitly not applicable","pilot sponsor named","rollback demonstrated","stop conditions accepted"],"critical_path":["gate_clinical_safety","gate_pilot_governance"],"notes":["Synthetic example only.","A Trust Passport prepares evidence but does not grant hospital approval."]}